{
  "schema_version": 1,
  "work_item_id": "IOS-CORE-001",
  "summary": "已实现无平台依赖且 Sendable 的稳定 ID、可注入 Clock/ID generator、稳定 Trace/AppIssue，以及区分 null/string/number 并支持任意精度数字无损 round-trip 的 JSONValue 基础；全部规定检查通过。",
  "evidence": "ios/harness/evidence/runs/run-20260722T095600Z-ios-core-001-f6fb2a9b.json",
  "capability_updates": [
    {
      "id": "CAP-CORE",
      "from_revision": 1,
      "to_revision": 2,
      "state_path": "ios/project/capabilities/CAP-CORE.json"
    }
  ],
  "architecture_impact": {
    "kind": "implements_existing",
    "adr_refs": ["ADR-0001"]
  },
  "requirements": {
    "mode": "enabler",
    "refs": [
      {
        "id": "REQ-ANDROID-BOOKSOURCE-SCHEMA-001",
        "revision": 1,
        "clauses": ["RC-01", "RC-02"]
      },
      {
        "id": "REQ-IOS-SOURCE-ROUNDTRIP-001",
        "revision": 1,
        "clauses": ["RC-01", "RC-02"]
      },
      {
        "id": "REQ-ANDROID-SOURCE-PIPELINE-001",
        "revision": 1,
        "clauses": ["RC-01", "RC-02", "RC-03", "RC-04"]
      }
    ],
    "selection_sha256": "c58e3d68c8cc7b3dfd09758b853716d4e962f75b193676c22ef05f400f75634f"
  },
  "source_lab": {
    "mode": "not_applicable",
    "behaviors": [],
    "scenarios": [],
    "selection_sha256": null
  },
  "compatibility": {
    "records": [],
    "none_reason": "本工作项只提供跨模块基础类型，尚未执行 Android/iOS 书源行为对比，因此没有观察到新的兼容差异"
  },
  "pitfalls": {
    "records": ["ios/project/pitfalls/PIT-0001.json"],
    "none_reason": null
  },
  "remaining_risks": [
    "JSONValue 的标准 Codable 桥接不能承诺保留任意精度数字的原始 token；SourceFormat 必须使用 JSONValueCodec",
    "当前验证运行于 macOS SwiftPM；iOS App 与真机集成由后续工作项覆盖"
  ],
  "next_actions": [
    "推进 IOS-RUNTIME-PORTS-001，定义确定性 HTTP 请求响应与 Transport port",
    "在 IOS-SOURCE-FORMAT-001 中复用 JSONValueCodec 完成 unknown fields 无损保留"
  ],
  "created_at": "2026-07-22T09:56:37Z"
}
